{
  "$schema": "https://json-schema.org/draft/2020-12/schema",
  "$id": "feature.json",
  "title": "Feature",
  "description": "A feature as seen by one recipient. When votingInProgress is true and the recipient is not the facilitator, criteria and score are null (FR-019a).",
  "type": "object",
  "additionalProperties": false,
  "required": [
    "id",
    "externalId",
    "title",
    "description",
    "version",
    "markedForReview",
    "reviewReason",
    "votingInProgress",
    "criteria",
    "score"
  ],
  "properties": {
    "id": {
      "type": "string",
      "format": "uuid"
    },
    "externalId": {
      "type": "string",
      "minLength": 1,
      "maxLength": 50
    },
    "title": {
      "type": "string",
      "minLength": 1,
      "maxLength": 200
    },
    "description": {
      "type": ["string", "null"],
      "maxLength": 5000
    },
    "version": {
      "type": "integer",
      "minimum": 0
    },
    "markedForReview": {
      "type": "boolean"
    },
    "reviewReason": {
      "type": ["string", "null"],
      "maxLength": 200
    },
    "votingInProgress": {
      "type": "boolean"
    },
    "criteria": {
      "oneOf": [
        {
          "$ref": "criteria.json"
        },
        {
          "type": "null"
        }
      ]
    },
    "score": {
      "oneOf": [
        {
          "$ref": "score.json"
        },
        {
          "type": "null"
        }
      ]
    }
  }
}
