{
  "id": "7a2d3e4f-5c6b-4d8e-9fa0-1b2c3d4e5f60",
  "externalId": "F-2",
  "title": "Export comptable",
  "description": null,
  "version": 0,
  "markedForReview": true,
  "reviewReason": "Valeurs à confirmer avec la finance.",
  "votingInProgress": false,
  "criteria": {
    "bv": 3,
    "tc": null
  },
  "score": {
    "complete": false,
    "outOfScale": [],
    "computed": null,
    "explanation": null,
    "rank": 2
  }
}
