{
  "id": "6f1c2d3e-4b5a-4c7d-8e9f-0a1b2c3d4e5f",
  "externalId": "F-1",
  "title": "Paiement en un clic",
  "description": "Permettre le paiement sans ressaisir la carte.",
  "version": 2,
  "markedForReview": false,
  "reviewReason": null,
  "votingInProgress": false,
  "criteria": {
    "bv": 8,
    "tc": 5,
    "rrOe": 3,
    "js": 4
  },
  "score": {
    "complete": true,
    "outOfScale": [],
    "computed": {
      "cod": {
        "numerator": 16,
        "denominator": 1,
        "display": "16"
      },
      "wsjf": {
        "numerator": 4,
        "denominator": 1,
        "display": "4,00"
      }
    },
    "explanation": "CoD = 8 + 5 + 3 = 16 ; WSJF = 16 / 4 = 4,00",
    "rank": 1
  }
}
