{
  "id": "6f1c2d3e-4b5a-4c7d-8e9f-0a1b2c3d4e5f",
  "externalId": "F-1",
  "title": "Connexion SSO",
  "description": "Permettre la connexion unique via l'annuaire de l'entreprise.",
  "version": 0,
  "markedForReview": false,
  "reviewReason": null,
  "criteria": null,
  "score": null,
  "votingInProgress": true
}
